{
  "$schema": "https://schema.gazebohq.com/v0.1/policy.json",
  "aip": "0.1",
  "agent_id": "stripe-payment-monitor",
  "install_id": "install_123",
  "version": "1.0.0",
  "policy": [
    {
      "service": "stripe",
      "actions": ["charges:list"]
    }
  ],
  "approval_rules": [
    {
      "service": "stripe",
      "actions": ["charges:list"],
      "threshold": {
        "amount_usd": 100,
        "record_count": 25
      },
      "requires_approval": true
    }
  ]
}